{
  "workflow": "ai-dev-workflow-factory",
  "status": "example",
  "currentState": "S10",
  "artifacts": {
    "projectBrief": "project-brief.md",
    "architecture": "ARCHITECTURE.md",
    "projectRules": "PROJECT_RULES.md",
    "requirement": "REQUIREMENT.md",
    "technicalDesign": "TECH_DESIGN.md",
    "implementationPlan": "IMPLEMENTATION_PLAN.md",
    "reviewReport": "REVIEW_REPORT.md",
    "generatedWorkflowSkill": "generated-workflow-skill.md"
  },
  "confirmations": {
    "requirement": true,
    "technicalDesign": true,
    "highRiskOperations": []
  },
  "checks": {
    "logicReview": "pass",
    "buildReview": "pass",
    "tests": "pass"
  },
  "lessons": [
    "Keep database migration rules explicit before implementation.",
    "Keep validator checks strict enough to catch missing confirmations and failed reviews."
  ]
}
